{"schema":1,"platform":"switch","generated":"2026-10-30","source":"blawar/titledb (US.en.json)","games":{"01000360107BC000":"0100CF10099B2000","010004F021380000":"01000AB01F9C0000","010005F016964000":"0100FF0015708000","010006001107E000":"010042C006490000","010008301A8C0000":"010017F0231BE000","01001230179CE000":"010061601676A000","010028701AB4E000":"0100F4E015480000","010050E0243A2000":"010006C015C4A000","010051000BEF2000":"0100E4D00A690000","010051B025770000":"010044A01B750000","010058702078C000":"0100D1C01B5B6000","0100679018C18000":"0100C250178BA000","01006960121A8000":"0100D06003056000","01006A200936C000":"0100AE0003424000","01006C60195B0000":"0100745011D28000","0100720008ED2000":"0100FF5005B76000","010075001CDAA000":"010093F00E818000","010077100CA6E000":"010001900BDCA000","010078A022B3E000":"0100C3200EBF4000","01007CC01FE14000":"0100179015DE0000","01008070226AE000":"01001AB014206000","01008480187C6000":"0100440012FFA000","01008F50155A6000":"010097E0141F0000","0100944009646000":"01008D8006A6A000","0100A0A018D3A000":"010035B018486000","0100B0101265C000":"01004A700DBD6000","0100BD8011BCC000":"0100A5800F6AC000","0100BE8019834000":"0100A22018A04000","0100C1700A9F0000":"0100F890078A8000","0100C7801C038000":"0100E3900B598000","0100CDC01E300000":"010025F0126FE000","0100CEF015DEE000":"0100EE40138C2000","0100D5C0210A8000":"0100B11016870000","0100D7B01AE58000":"0100BA0003EEA000","0100E1F013674000":"010089D00E28A000","0100E67012924000":"0100BFE00E9CA000","0100EC6020A8A000":"0100B4101459A000","0100F0E0179D0000":"0100A12016BAC000","0100F5D01034E000":"010035C00A4BC000"}}
